{
  "$schema": "http://json-schema.org/draft-07/schema#",
  "title": "RetrainStatus",
  "type": "object",
  "required": ["job_id", "started_at", "status"],
  "properties": {
    "job_id": {"type": "string", "description": "Unique job identifier (UUID)"},
    "trigger": {
      "type": "object",
      "properties": {
        "by": {"type": "string"},
        "source": {"type": "string", "enum": ["manual", "schedule", "data_drift", "other"]},
        "reason": {"type": "string"}
      },
      "additionalProperties": false
    },
    "started_at": {"type": ["string", "null"], "format": "date-time"},
    "finished_at": {"type": ["string", "null"], "format": "date-time"},
    "status": {"type": "string", "enum": ["pending", "running", "success", "failed", "cancelled"]},
    "progress": {"type": "number", "minimum": 0, "maximum": 100},
    "current_step": {"type": "string"},
    "steps": {
      "type": "array",
      "items": {
        "type": "object",
        "required": ["name", "status"],
        "properties": {
          "name": {"type": "string"},
          "status": {"type": "string", "enum": ["pending", "running", "done", "failed"]},
          "started_at": {"type": ["string", "null"], "format": "date-time"},
          "finished_at": {"type": ["string", "null"], "format": "date-time"},
          "meta": {"type": "object"}
        },
        "additionalProperties": false
      }
    },
    "logs": {
      "type": "array",
      "items": {
        "type": "object",
        "properties": {
          "ts": {"type": "string", "format": "date-time"},
          "level": {"type": "string", "enum": ["DEBUG", "INFO", "WARN", "ERROR"]},
          "message": {"type": "string"}
        },
        "required": ["ts", "level", "message"],
        "additionalProperties": false
      }
    },
    "metrics": {"type": "object"},
    "model_artifact": {
      "type": "object",
      "properties": {
        "path": {"type": "string"},
        "version": {"type": "string"},
        "checksum": {"type": "string"}
      },
      "additionalProperties": false
    },
    "retry_count": {"type": "integer", "minimum": 0},
    "tags": {"type": "array", "items": {"type": "string"}}
  },
  "additionalProperties": false
}
